Name,Ticker
First Asset Core U.S. Equity ETF,CES-B.TO
First Asset Core U.S. Equity ETF,CES.TO
First Asset Core U.S. Equity ETF,CES-A.TO
First Asset 1-5 Year Laddered Government Strip Bond Index ETF,BXF.TO
First Asset Core Canadian Equity ETF,CED-A.TO
FIRST ASSET CORE US EQUITY ETF,CES-U.TO
First Asset Morningstar Canada Dividend Target 30 Index ETF,DXM.TO
CES-V.TO,CES-V.TO
First Asset Mstar EM Comp Bd ETF Comm,EXM.TO
CES-D.TO,CES-D.TO
iShares Balanced Income CorePortfolio Index ETF,CBD-A.TO
iShares S&P/TSX Global Base Metals Index ETF,XBM.TO
Purpose Fund Corp. - Purpose Core Dividend Fund,PDF.TO
iShares MSCI Europe IMI Index ETF (CAD-Hedged),XEH.TO
iShares 1-10 Year Laddered Corporate Bond Index ETF,CBH-A.TO
iShares Convertible Bond Index ETF,CVD-A.TO
iShares U.S. IG Corporate Bond Index ETF (CAD-Hedged),XIG.TO
iShares BRIC Index ETF,CBQ.TO
iShares MSCI Brazil Index ETF,XBZ.TO
iShares Emerging Markets Fundamental Index ETF,CWO.TO
iShares Gold Bullion ETF,CGL.TO
iShares Silver Bullion ETF,SVR.TO
iShares S&P/TSX Capped Utilities Index ETF,XUT.TO
iShares S&P/TSX Capped Consumer Staples Index ETF,XST.TO
iShares Canadian Fundamental Index ETF,CRQ-A.TO
iShares Canadian Growth Index ETF,XCG.TO
iShares Core MSCI Emerging Markets IMI Index ETF,XEC.TO
iShares Core MSCI EAFE IMI Index ETF,XEF.TO
iShares Emerging Markets Fundamental Index ETF,CWO-A.TO
iShares S&P Global Industrials Index ETF (CAD-Hedged),XGI.TO
iShares S&P/TSX SmallCap Index ETF,XCS.TO
